{
  "$schema": "http://json-schema.org/draft/2020-12/schema#",
  "title": "Phi Lexicon Entry",
  "type": "object",
  "properties": {
    "word": {
      "type": "string",
      "description": "The Phi word."
    },
    "gloss": {
      "type": "string",
      "description": "A concise, 1-2 word English gloss or a Leipzig abbreviation for grammatical particles."
    },
    "ipa": {
      "type": "string",
      "description": "The International Phonetic Alphabet transcription, including stress marks and syllable breaks."
    },
    "syllables": {
      "type": "array",
      "items": {
        "type": "string"
      },
      "description": "The word broken down into its constituent CV syllables for rule validation."
    },
    "slot": {
      "type": [
        "integer",
        "null"
      ],
      "description": "For grammatical particles, defines their position in the sentence structure. Null for content words."
    },
    "pos": {
      "type": "array",
      "items": {
        "type": "string"
      },
      "description": "The possible parts of speech (e.g., 'noun', 'verb', 'particle')."
    },
    "concept": {
      "type": "string",
      "description": "The full concept name from the unified concepts document or grammar role."
    },
    "description": {
      "type": "string",
      "description": "The detailed description of the concept's meaning and nuance."
    },
    "sound_symbolism": {
      "type": "string",
      "description": "The poetic description of how the word's sounds embody its meaning through phonetic symbolism."
    },
    "grammatical_notes": {
      "type": "string",
      "description": "Cross-linguistic context explaining the word's grammatical flexibility and syntactic patterns."
    },
    "pillars": {
      "type": "object",
      "properties": {
        "solarpunk-values": {
          "type": "string",
          "description": "Rationale for how this concept embodies solarpunk values."
        },
        "secular-buddhist-philosophy": {
          "type": "string",
          "description": "Rationale for how this concept embodies secular Buddhist philosophy."
        },
        "art-nouveau-aesthetics": {
          "type": "string",
          "description": "Rationale for how this concept embodies Art Nouveau aesthetics."
        },
        "peace-linguistics-practices": {
          "type": "string",
          "description": "Rationale for how this concept embodies peace linguistics practices."
        },
        "pre-industrial-wisdom": {
          "type": "string",
          "description": "Rationale for how this concept embodies pre-industrial wisdom."
        }
      },
      "additionalProperties": false,
      "description": "The philosophical pillars this concept primarily embodies, with rationales for each."
    },
    "tags": {
      "type": "array",
      "items": {
        "type": "string"
      },
      "description": "Categorical tags."
    }
  },
  "required": [
    "word",
    "gloss",
    "ipa",
    "syllables",
    "pos",
    "concept",
    "description",
    "sound_symbolism",
    "pillars"
  ],
  "additionalProperties": false
}