{
  "word": "phewani",
  "gloss": "neighbor",
  "ipa": "/ɸe.ˈwa.ni/",
  "syllables": [
    "phe",
    "wa",
    "ni"
  ],
  "pos": [
    "noun"
  ],
  "concept": "Neighbor / One Who Shares Daily Life",
  "description": "Those who share an immediate, core space and the daily rhythms of life. The relationship is defined by proximity and the potential for mutual, everyday support.",
  "sound_symbolism": "The gentle breath of 'ph' suggests the casual hellos exchanged over fences. The welcoming 'wa' creates the shared space between homes, while the intimate 'ni' acknowledges the unique closeness of those who witness each other's daily lives. This word captures the warmth of borrowed sugar and shared tools, of knowing each other's routines and being there in small but meaningful ways.",
  "pillars": {
    "solarpunk-values": "Neighbors form the foundation of resilient communities through hyperlocal mutual aid, tool sharing, and collective care. This isn't just living near each other but actively cultivating relationships that reduce individual resource needs while increasing collective abundance. Neighborly connections create the village-scale networks essential for sustainable futures.",
    "peace-linguistics-practices": "Neighborly relationships practice peace at the most intimate scale - learning to navigate differences with those we cannot avoid. Daily proximity requires skills in boundary-setting, conflict resolution, and finding common ground despite diverse lifestyles. These micro-negotiations of shared space teach the larger patterns of peaceful coexistence.",
    "pre-industrial-wisdom": "Traditional neighborhoods functioned as extended support networks where proximity created obligation and care. Before isolated nuclear families, neighbors shared childcare, celebrated harvests together, and provided first-response aid. This wisdom recognizes that those physically nearest often become our most reliable safety net."
  }
}