{
  "word": "sui",
  "gloss": "DUR",
  "ipa": "/ˈsu.i/",
  "syllables": ["su", "i"],
  "pos": ["postposition"],
  "concept": "During / Throughout / Within the Time of",
  "description": "Marks temporal relationships of containment, indicating that something occurs within the bounds of a temporal period. More than mere simultaneity, 'sui' acknowledges the embrace of duration, how time holds events like a river holds flowing water—contained yet moving.",
  "sound_symbolism": "The word begins with 'su', where the soft sibilant 's' flows like time itself—continuous, impossible to grasp firmly. The back vowel 'u' suggests depth and interiority, the sense of being within temporal flow. This deep immersion then focuses to 'i', the precise vowel that marks specific awareness within the stream. The acoustic journey from flowing depth to focused presence mirrors how we experience duration—immersed in time's flow yet capable of precise attention within it. The liquid quality makes duration audible.",
  "grammatical_notes": "Functions as a temporal postposition marking containment within time periods rather than points. Follows noun phrases denoting durations: 'ceremony sui' (ceremony-during = during the ceremony), 'winter sui' (winter-during = during winter), 'meditation sui' (meditation-during = during meditation). Unlike momentary temporal markers, 'sui' requires its object to have duration. Can imply continuous action throughout the period or intermittent occurrence within it—context clarifies.",
  "pillars": {
    "secular-buddhist-philosophy": "The word embodies the teaching of present-moment awareness extended through time. Like meditation that sustains attention without grasping, 'sui' marks presence that continues without freezing, awareness that flows with rather than against time.",
    "pre-industrial-wisdom": "Natural rhythms create containers of time—during harvest, during the rains, during migration. 'Sui' honors these organic durations that shape activity according to natural patterns rather than mechanical divisions.",
    "solarpunk-values": "Regenerative systems require understanding natural durations—growth cycles, restoration periods, seasonal patterns. 'Sui' serves the practice of aligning human activity with ecological timeframes, respecting the temporal containers that sustain life."
  }
}