{
  "word": "noa",
  "gloss": "ORD",
  "ipa": "/ˈno.a/",
  "syllables": ["no", "a"],
  "pos": ["postposition"],
  "concept": "Ordinal Marker / -th / Position in Sequence",
  "description": "Transforms cardinal numbers into ordinal numbers by marking position within a sequence. More than mechanical conversion, 'noa' acknowledges the profound difference between quantity and position, between counting things and finding one's place among them.",
  "sound_symbolism": "The word begins with 'no', where the nasal 'n' grounds and the round 'o' encompasses—together suggesting established position within a whole. This solid placement opens into 'a', the most expansive vowel, acknowledging that each position exists within a larger sequence. The acoustic journey from grounded position to open context mirrors how ordinal thinking works—specific placement gains meaning from the sequence that contains it. The resonant quality suggests how positions echo through sequences.",
  "grammatical_notes": "Functions as a postpositional ordinal marker—follows numbers to transform them into ordinals: 'ta noa' (one-ORD = first), 'wi noa' (two-ORD = second), 'ta sha noa' (three-ORD = third). This postposition aligns with Phi's head-final structure where postpositions follow their complements. Applies to any countable sequence: temporal (days, years), spatial (floors, positions), or abstract (attempts, priorities). Creates ordinal numbers that can then function as modifiers or nominals. Essential for discussing sequence, rank, or position without implying hierarchy of value.",
  "pillars": {
    "peace-linguistics-practices": "By marking position without implying superiority, 'noa' enables discussion of order without creating hierarchy. First is not better than fifth; each position has its place in the sequence. This linguistic choice reduces competition while maintaining useful distinctions.",
    "pre-industrial-wisdom": "Natural sequences—phases of moon, seasons, life stages—teach that position in cycle matters more than abstract rank. 'Noa' carries this understanding that 'third' or 'seventh' are qualities of relationship within wholes, not measures of worth.",
    "secular-buddhist-philosophy": "The word acknowledges the conventional nature of sequence—positions exist only in relation to the whole, first defining last as much as last defines first. This interdependence of ordinal positions mirrors the teaching of mutual arising."
  }
}