{
  "word": "sheo",
  "gloss": "THAN",
  "ipa": "/ˈʃe.o/",
  "syllables": ["she", "o"],
  "pos": ["postposition"],
  "concept": "Than / Compared to / In Relation to",
  "description": "Marks the standard of comparison in comparative constructions, establishing the reference point against which differences are measured. More than creating hierarchy, 'sheo' acknowledges relationship through difference, the way distinct qualities reveal themselves through comparison without requiring judgment of worth.",
  "sound_symbolism": "The word begins with 'she', where the soft fricative 'ʃ' whispers like the subtle act of comparing—not harsh judgment but gentle observation of difference. The mid vowel 'e' suggests the specific point of comparison. This focused attention then opens into 'o', acknowledging the wholeness of what is compared against. The acoustic journey from soft observation through specific focus to encompassing recognition mirrors how healthy comparison works—noticing differences while honoring the completeness of both entities.",
  "grammatical_notes": "Functions as the comparative postposition, required after comparative forms marked with particle 'mo'. Follows the noun being compared against: 'miona sheo mo wela' (person-than more good = better than a person). Creates the standard against which comparison is made. Works with all comparable qualities—physical attributes, abstract qualities, or actions. Maintains neutrality about whether difference implies superiority—context determines evaluative force.",
  "pillars": {
    "peace-linguistics-practices": "By using soft sounds rather than harsh ones, 'sheo' makes comparison less aggressive. It enables discussion of differences without creating conflict, acknowledging that comparison can be observation rather than competition.",
    "secular-buddhist-philosophy": "The word acknowledges the conventional nature of comparison—qualities exist in relationship, not as absolute properties. The soft articulation reminds us to hold comparisons lightly, as useful tools rather than ultimate truths.",
    "solarpunk-values": "Evaluating alternatives requires comparison—renewable versus extractive, local versus global, regenerative versus degenerative. 'Sheo' serves the necessary practice of assessment without hierarchy, measuring effectiveness rather than imposing value judgments."
  }
}